<?xml version="1.0" encoding="UTF-8"?>
<myxml:OldCards
	xmlns:xsi="http://www.w3.org/2001/XMLSchema-instance"
	xmlns:myxml="http://nure.ua/kharkov/SummaryTask3/entity"
	xsi:schemaLocation="http://nure.ua/kharkov/SummaryTask3/entity input.xsd">
	<OldCard>
		<Thema>Nature</Thema>
		<Type send="true">Normal</Type>
		<Country>Ukraine</Country>
		<Year>2001</Year>
		<Author>Ivan Beda</Author>
		<Author>Anton Bobov</Author>
		<Valuable>Thematic</Valuable>
	</OldCard>

	<OldCard>
		<Thema>People</Thema>
		<Type>Normal</Type>
		<Country>USA</Country>
		<Year>1968</Year>
		<Valuable>Historical</Valuable>
	</OldCard>

	<OldCard>
		<Thema>Sport</Thema>
		<Type>Advertising</Type>
		<Country>USA</Country>
		<Year>2010</Year>
		<Author>James Onil</Author>
		<Valuable>Thematic</Valuable>
	</OldCard>

</myxml:OldCards>